{
  "kind": "evidence_graph",
  "ir_version": "0.1.0",
  "change_request": "CR-014",
  "evidence": [
    {
      "id": "evidence:test-exceeds-allowance",
      "kind": "test",
      "status": "pass",
      "summary": "Driving one owner past the allowance within a minute is answered 429 and creates no visit row.",
      "discharges": ["acceptance:429-after-limit", "behavior:reject-excess-visit-creation"],
      "covers": ["edit:add-rate-limit-filter", "edit:reject-with-retry-after"],
      "check": "check:visits.rate-limit.exceeds",
      "artifact": {
        "binding": "junit",
        "uri": "runs/CR-014/junit/visits-rate-limit-exceeds.xml",
        "format_version": "5",
        "sha256": "a1b2c3d4a1b2c3d4a1b2c3d4a1b2c3d4a1b2c3d4a1b2c3d4a1b2c3d4a1b2c3d4"
      },
      "observed_at": "2026-08-27T10:12:00Z"
    },
    {
      "id": "evidence:test-retry-after",
      "kind": "test",
      "status": "pass",
      "summary": "Every rejection carries a Retry-After header with a positive whole number of seconds.",
      "discharges": ["acceptance:retry-after-header", "behavior:report-retry-after"],
      "covers": ["edit:reject-with-retry-after"],
      "check": "check:visits.rate-limit.retry-after",
      "artifact": {
        "binding": "junit",
        "uri": "runs/CR-014/junit/visits-rate-limit-retry-after.xml",
        "format_version": "5",
        "sha256": "b2c3d4e5b2c3d4e5b2c3d4e5b2c3d4e5b2c3d4e5b2c3d4e5b2c3d4e5b2c3d4e5"
      },
      "observed_at": "2026-08-27T10:12:40Z"
    },
    {
      "id": "evidence:test-under-allowance",
      "kind": "test",
      "status": "pass",
      "summary": "Creation at the observed clinic peak succeeds with 201 throughout.",
      "discharges": ["acceptance:normal-rate-unaffected", "behavior:allow-normal-rate"],
      "covers": ["edit:configure-allowance"],
      "check": "check:visits.rate-limit.under-limit",
      "artifact": {
        "binding": "junit",
        "uri": "runs/CR-014/junit/visits-rate-limit-under-limit.xml",
        "format_version": "5",
        "sha256": "c3d4e5f6c3d4e5f6c3d4e5f6c3d4e5f6c3d4e5f6c3d4e5f6c3d4e5f6c3d4e5f6"
      },
      "observed_at": "2026-08-27T10:13:10Z"
    },
    {
      "id": "evidence:contract-diff",
      "kind": "static_analysis",
      "status": "pass",
      "summary": "The generated contract differs from the baseline only by the additive 429 response and its header.",
      "discharges": ["acceptance:contract-unchanged", "constraint:backward-compatible-api"],
      "covers": ["edit:reject-with-retry-after"],
      "check": "check:visits.openapi.compatibility",
      "artifact": {
        "binding": "sarif",
        "uri": "runs/CR-014/sarif/openapi-compatibility.sarif",
        "format_version": "2.1.0",
        "sha256": "d4e5f6a7d4e5f6a7d4e5f6a7d4e5f6a7d4e5f6a7d4e5f6a7d4e5f6a7d4e5f6a7"
      },
      "observed_at": "2026-08-27T10:14:00Z"
    },
    {
      "id": "evidence:dependency-policy",
      "kind": "static_analysis",
      "status": "pass",
      "summary": "The dependency policy reports no addition to the visits service classpath.",
      "discharges": ["constraint:no-new-external-dependency"],
      "covers": ["edit:add-rate-limit-filter", "edit:configure-allowance"],
      "artifact": {
        "binding": "sarif",
        "uri": "runs/CR-014/sarif/dependency-policy.sarif",
        "format_version": "2.1.0",
        "sha256": "e5f6a7b8e5f6a7b8e5f6a7b8e5f6a7b8e5f6a7b8e5f6a7b8e5f6a7b8e5f6a7b8"
      },
      "observed_at": "2026-08-27T10:14:20Z"
    },
    {
      "id": "evidence:log-field-policy",
      "kind": "static_analysis",
      "status": "pass",
      "summary": "The logging policy admits every field on the rejection path; the owner identifier appears only as a salted hash.",
      "discharges": ["constraint:no-pii-in-logs"],
      "covers": ["edit:reject-with-retry-after"],
      "artifact": {
        "binding": "sarif",
        "uri": "runs/CR-014/sarif/log-field-policy.sarif",
        "format_version": "2.1.0",
        "sha256": "f6a7b8c9f6a7b8c9f6a7b8c9f6a7b8c9f6a7b8c9f6a7b8c9f6a7b8c9f6a7b8c9"
      },
      "observed_at": "2026-08-27T10:14:45Z"
    },
    {
      "id": "evidence:soak-trace",
      "kind": "runtime",
      "status": "pass",
      "summary": "Traces and metrics captured over the soak profile against the rolled-out service.",
      "discharges": ["behavior:allow-normal-rate"],
      "covers": ["deployment:visits-rollout"],
      "artifact": {
        "binding": "opentelemetry",
        "uri": "runs/CR-014/otel/soak-traces.jsonl",
        "format_version": "1.7.0",
        "sha256": "a7b8c9d0a7b8c9d0a7b8c9d0a7b8c9d0a7b8c9d0a7b8c9d0a7b8c9d0a7b8c9d0"
      },
      "observed_at": "2026-08-27T11:02:00Z"
    },
    {
      "id": "evidence:latency-overhead",
      "kind": "runtime",
      "status": "pass",
      "summary": "The p99 latency overhead computed from the soak traces stays inside the stated bound.",
      "discharges": ["constraint:p99-overhead"],
      "covers": ["deployment:visits-rollout"],
      "derived_from": ["evidence:soak-trace"],
      "artifact": {
        "binding": "opentelemetry",
        "uri": "runs/CR-014/otel/latency-overhead.jsonl",
        "format_version": "1.7.0",
        "sha256": "b8c9d0e1b8c9d0e1b8c9d0e1b8c9d0e1b8c9d0e1b8c9d0e1b8c9d0e1b8c9d0e1"
      },
      "observed_at": "2026-08-27T11:06:00Z"
    },
    {
      "id": "evidence:rollout-review",
      "kind": "review",
      "status": "pass",
      "summary": "Reviewed projection of the plan and its evidence: the limiter holds state in process memory and adds no cache tier.",
      "discharges": ["constraint:limiter-state-cost"],
      "covers": ["deployment:visits-rollout"],
      "derived_from": ["evidence:contract-diff", "evidence:latency-overhead"],
      "artifact": {
        "binding": "text",
        "uri": "runs/CR-014/review/rollout-review.md",
        "sha256": "c9d0e1f2c9d0e1f2c9d0e1f2c9d0e1f2c9d0e1f2c9d0e1f2c9d0e1f2c9d0e1f2"
      },
      "observed_at": "2026-08-27T11:20:00Z"
    }
  ]
}
